{
  "$schema": "https://json-schema.org/draft/2020-12/schema",
  "$id": "https://raw.githubusercontent.com/EdouardCourty/rustle/main/bench/data/schema/benchmarks.schema.json",
  "title": "rustle benchmark results of one campaign",
  "description": "The published benchmark numbers of one campaign: rustle against 3proxy, Squid, gost and Tinyproxy. The conditions are in the campaign's campaign.json, the competitors in its proxies.json. Generated by bench/tools/site-data.py from the campaign indexes; read by the rustle website at the release tag.",
  "type": "object",
  "additionalProperties": false,
  "required": [
    "schema_version",
    "campaign",
    "tests",
    "scaling",
    "ktls"
  ],
  "properties": {
    "$schema": {
      "title": "Schema pointer",
      "description": "Relative path to this schema, for editors.",
      "const": "../schema/benchmarks.schema.json"
    },
    "schema_version": {
      "title": "Schema version",
      "description": "Version of this contract. A breaking change bumps it; readers must refuse a version they do not know.",
      "const": 1
    },
    "campaign": {
      "title": "Campaign",
      "description": "Id of the campaign (its folder name under bench/data/ and bench/published/). Conditions are in that folder's campaign.json; numbers are not comparable across campaigns.",
      "type": "string",
      "pattern": "^\\d{4}-\\d{2}-\\d{2}(-[a-z0-9]+)*$"
    },
    "tests": {
      "title": "Tests",
      "description": "One entry per published metric, in reading order.",
      "type": "array",
      "items": {
        "$ref": "#/$defs/test",
        "title": "Test",
        "description": "One metric for every proxy."
      }
    },
    "scaling": {
      "title": "Multi-core scaling",
      "description": "Throughput against the number of proxy cores.",
      "type": "array",
      "items": {
        "$ref": "#/$defs/scalingSeries",
        "title": "Scaling series",
        "description": "One metric measured for 1, 2, 4 and 8 cores."
      }
    },
    "ktls": {
      "title": "Kernel TLS",
      "description": "rustle with tls.ktls off and on, on the tests of the TLS matrix.",
      "type": "array",
      "items": {
        "$ref": "#/$defs/ktlsEntry",
        "title": "kTLS comparison",
        "description": "One metric, rustle against itself."
      }
    }
  },
  "$defs": {
    "proxyId": {
      "title": "Proxy id",
      "description": "Identifier of a compared proxy. A new proxy is added here (and to the by-proxy maps): an additive change.",
      "enum": [
        "rustle",
        "3proxy",
        "squid",
        "gost",
        "tinyproxy"
      ]
    },
    "unit": {
      "title": "Unit",
      "description": "Unit of a value.",
      "enum": [
        "req/s",
        "msg/s",
        "Gbit/s",
        "MB",
        "µs/req",
        "µs/msg",
        "ms"
      ]
    },
    "direction": {
      "title": "Direction",
      "description": "Which way is better: higher or lower values.",
      "enum": [
        "higher",
        "lower"
      ]
    },
    "nullableNumber": {
      "title": "Number or null",
      "description": "A measured value, or null when there is none.",
      "anyOf": [
        {
          "type": "number"
        },
        {
          "type": "null"
        }
      ]
    },
    "nullableInteger": {
      "title": "Integer or null",
      "description": "A connection count, or null when not applicable.",
      "anyOf": [
        {
          "type": "integer"
        },
        {
          "type": "null"
        }
      ]
    },
    "nullableString": {
      "title": "String or null",
      "description": "Text, or null when there is none.",
      "anyOf": [
        {
          "type": "string"
        },
        {
          "type": "null"
        }
      ]
    },
    "valuesByProxy": {
      "title": "Values by proxy",
      "description": "One measured value per proxy; null when the proxy has no number (see status). Keys are the proxies of the campaign (proxies.json); the check requires exactly those.",
      "type": "object",
      "additionalProperties": false,
      "properties": {
        "rustle": {
          "$ref": "#/$defs/nullableNumber",
          "title": "rustle",
          "description": "Value for rustle."
        },
        "3proxy": {
          "$ref": "#/$defs/nullableNumber",
          "title": "3proxy",
          "description": "Value for 3proxy."
        },
        "squid": {
          "$ref": "#/$defs/nullableNumber",
          "title": "Squid",
          "description": "Value for Squid."
        },
        "gost": {
          "$ref": "#/$defs/nullableNumber",
          "title": "gost",
          "description": "Value for gost."
        },
        "tinyproxy": {
          "$ref": "#/$defs/nullableNumber",
          "title": "Tinyproxy",
          "description": "Value for Tinyproxy."
        }
      }
    },
    "connsByProxy": {
      "title": "Connection level by proxy",
      "description": "Concurrency level of the best clean point, per proxy; null when not applicable. Keys are the proxies of the campaign (proxies.json); the check requires exactly those.",
      "type": "object",
      "additionalProperties": false,
      "properties": {
        "rustle": {
          "$ref": "#/$defs/nullableInteger",
          "title": "rustle",
          "description": "Connections for rustle."
        },
        "3proxy": {
          "$ref": "#/$defs/nullableInteger",
          "title": "3proxy",
          "description": "Connections for 3proxy."
        },
        "squid": {
          "$ref": "#/$defs/nullableInteger",
          "title": "Squid",
          "description": "Connections for Squid."
        },
        "gost": {
          "$ref": "#/$defs/nullableInteger",
          "title": "gost",
          "description": "Connections for gost."
        },
        "tinyproxy": {
          "$ref": "#/$defs/nullableInteger",
          "title": "Tinyproxy",
          "description": "Connections for Tinyproxy."
        }
      }
    },
    "status": {
      "title": "Status",
      "description": "ok: a clean number. unsupported: the proxy cannot do the test (no listener, no WebSocket). not_measured: it could, but was not run. invalid: client errors, not publishable.",
      "enum": [
        "ok",
        "unsupported",
        "not_measured",
        "invalid"
      ]
    },
    "statusByProxy": {
      "title": "Status by proxy",
      "description": "Why a proxy has, or has not, a number. Keys are the proxies of the campaign (proxies.json); the check requires exactly those.",
      "type": "object",
      "additionalProperties": false,
      "properties": {
        "rustle": {
          "$ref": "#/$defs/status",
          "title": "rustle",
          "description": "Status for rustle."
        },
        "3proxy": {
          "$ref": "#/$defs/status",
          "title": "3proxy",
          "description": "Status for 3proxy."
        },
        "squid": {
          "$ref": "#/$defs/status",
          "title": "Squid",
          "description": "Status for Squid."
        },
        "gost": {
          "$ref": "#/$defs/status",
          "title": "gost",
          "description": "Status for gost."
        },
        "tinyproxy": {
          "$ref": "#/$defs/status",
          "title": "Tinyproxy",
          "description": "Status for Tinyproxy."
        }
      }
    },
    "flagList": {
      "title": "Flags",
      "description": "proxy_unsaturated: the proxy used under 90 % of its core at that point (the harness or the link set the number). harness_saturated: the origin or the sink was above 90 %.",
      "type": "array",
      "items": {
        "enum": [
          "proxy_unsaturated",
          "harness_saturated"
        ]
      }
    },
    "flagsByProxy": {
      "title": "Flags by proxy",
      "description": "Saturation flags of each proxy's point. Keys are the proxies of the campaign (proxies.json); the check requires exactly those.",
      "type": "object",
      "additionalProperties": false,
      "properties": {
        "rustle": {
          "$ref": "#/$defs/flagList",
          "title": "rustle",
          "description": "Flags for rustle."
        },
        "3proxy": {
          "$ref": "#/$defs/flagList",
          "title": "3proxy",
          "description": "Flags for 3proxy."
        },
        "squid": {
          "$ref": "#/$defs/flagList",
          "title": "Squid",
          "description": "Flags for Squid."
        },
        "gost": {
          "$ref": "#/$defs/flagList",
          "title": "gost",
          "description": "Flags for gost."
        },
        "tinyproxy": {
          "$ref": "#/$defs/flagList",
          "title": "Tinyproxy",
          "description": "Flags for Tinyproxy."
        }
      }
    },
    "test": {
      "title": "Test",
      "description": "One metric measured for every proxy.",
      "type": "object",
      "additionalProperties": false,
      "required": [
        "id",
        "transport",
        "label",
        "unit",
        "direction",
        "conditions",
        "chart",
        "values",
        "at_conns",
        "status",
        "flags"
      ],
      "properties": {
        "id": {
          "title": "Id",
          "description": "Stable identifier, <transport>-<test>.",
          "type": "string",
          "pattern": "^[a-z0-9]+(-[a-z0-9]+)*$"
        },
        "transport": {
          "title": "Transport",
          "description": "How the client reaches the proxy.",
          "enum": [
            "plain",
            "tls",
            "tls-full-handshake",
            "h2",
            "ws",
            "ws-tls"
          ]
        },
        "label": {
          "title": "Label",
          "description": "Short name of the metric.",
          "type": "string",
          "minLength": 1
        },
        "unit": {
          "$ref": "#/$defs/unit",
          "title": "Unit",
          "description": "Unit of the values."
        },
        "direction": {
          "$ref": "#/$defs/direction",
          "title": "Direction",
          "description": "Which way is better."
        },
        "conditions": {
          "title": "Conditions",
          "description": "A sentence to print next to the number: workload and transport.",
          "type": "string",
          "minLength": 1
        },
        "chart": {
          "$ref": "#/$defs/nullableString",
          "title": "Chart",
          "description": "File name of the chart in docs/benchmarks/, or null."
        },
        "values": {
          "$ref": "#/$defs/valuesByProxy",
          "title": "Values",
          "description": "The measured value of each proxy."
        },
        "at_conns": {
          "$ref": "#/$defs/connsByProxy",
          "title": "Connections",
          "description": "Concurrency level of each proxy's best point."
        },
        "status": {
          "$ref": "#/$defs/statusByProxy",
          "title": "Status",
          "description": "Why a proxy has, or has not, a number."
        },
        "flags": {
          "$ref": "#/$defs/flagsByProxy",
          "title": "Flags",
          "description": "Saturation flags of each proxy's point."
        },
        "cpu_us": {
          "$ref": "#/$defs/valuesByProxy",
          "title": "CPU per request",
          "description": "Microseconds of proxy CPU per request or message at each proxy's best point (http, ws-64b, ws-short tests)."
        },
        "cpu_ms_per_gb": {
          "$ref": "#/$defs/valuesByProxy",
          "title": "CPU per GB",
          "description": "Milliseconds of proxy CPU per decimal gigabyte moved at each proxy's best point (tunnels and 64 KB WebSocket frames)."
        },
        "p99_ms": {
          "$ref": "#/$defs/valuesByProxy",
          "title": "p99 latency",
          "description": "p99 latency in milliseconds at each proxy's best point (WebSocket tests)."
        },
        "proxy_util": {
          "$ref": "#/$defs/valuesByProxy",
          "title": "Proxy utilisation",
          "description": "Proxy CPU over the cores it was given at each proxy's best point, 0 to 1."
        }
      }
    },
    "scalingPoint": {
      "title": "Scaling point",
      "description": "The result for one core count.",
      "type": "object",
      "additionalProperties": false,
      "required": [
        "cores",
        "values",
        "at_conns",
        "flags"
      ],
      "properties": {
        "cores": {
          "title": "Cores",
          "description": "Cores given to the proxy.",
          "type": "integer",
          "minimum": 1
        },
        "values": {
          "$ref": "#/$defs/valuesByProxy",
          "title": "Values",
          "description": "The measured value of each proxy."
        },
        "at_conns": {
          "$ref": "#/$defs/connsByProxy",
          "title": "Connections",
          "description": "Concurrency level of each proxy's best point."
        },
        "flags": {
          "$ref": "#/$defs/flagsByProxy",
          "title": "Flags",
          "description": "Saturation flags of each proxy's point."
        },
        "proxy_util": {
          "$ref": "#/$defs/valuesByProxy",
          "title": "Proxy utilisation",
          "description": "Proxy CPU over the cores it was given, 0 to 1."
        },
        "origin_util": {
          "$ref": "#/$defs/valuesByProxy",
          "title": "Origin utilisation",
          "description": "Origin CPU over its threads, 0 to 1."
        }
      }
    },
    "scalingSeries": {
      "title": "Scaling series",
      "description": "One metric measured for several core counts.",
      "type": "object",
      "additionalProperties": false,
      "required": [
        "id",
        "label",
        "unit",
        "direction",
        "conditions",
        "not_measured",
        "points"
      ],
      "properties": {
        "id": {
          "title": "Id",
          "description": "Stable identifier.",
          "type": "string",
          "pattern": "^[a-z0-9]+(-[a-z0-9]+)*$"
        },
        "label": {
          "title": "Label",
          "description": "Short name of the series.",
          "type": "string",
          "minLength": 1
        },
        "unit": {
          "$ref": "#/$defs/unit",
          "title": "Unit",
          "description": "Unit of the values."
        },
        "direction": {
          "$ref": "#/$defs/direction",
          "title": "Direction",
          "description": "Which way is better."
        },
        "conditions": {
          "title": "Conditions",
          "description": "How the series was measured.",
          "type": "string",
          "minLength": 1
        },
        "not_measured": {
          "title": "Not measured",
          "description": "Proxies left out of the series.",
          "type": "array",
          "items": {
            "$ref": "#/$defs/proxyId",
            "title": "Proxy",
            "description": "A proxy id."
          }
        },
        "points": {
          "title": "Points",
          "description": "One point per core count, ascending.",
          "type": "array",
          "minItems": 1,
          "items": {
            "$ref": "#/$defs/scalingPoint",
            "title": "Point",
            "description": "The result for one core count."
          }
        }
      }
    },
    "ktlsEntry": {
      "title": "kTLS comparison",
      "description": "One metric of the TLS matrix for rustle with user-space TLS and with kernel TLS.",
      "type": "object",
      "additionalProperties": false,
      "required": [
        "id",
        "label",
        "unit",
        "direction",
        "user_space",
        "ktls"
      ],
      "properties": {
        "id": {
          "title": "Id",
          "description": "Id of the matching tls-* test.",
          "type": "string",
          "pattern": "^[a-z0-9]+(-[a-z0-9]+)*$"
        },
        "label": {
          "title": "Label",
          "description": "Short name of the metric.",
          "type": "string",
          "minLength": 1
        },
        "unit": {
          "$ref": "#/$defs/unit",
          "title": "Unit",
          "description": "Unit of the values."
        },
        "direction": {
          "$ref": "#/$defs/direction",
          "title": "Direction",
          "description": "Which way is better."
        },
        "user_space": {
          "title": "User-space TLS",
          "description": "rustle with tls.ktls = false (rustls in user space).",
          "type": "number"
        },
        "ktls": {
          "title": "Kernel TLS",
          "description": "rustle with tls.ktls = true.",
          "type": "number"
        },
        "user_space_cpu_ms_per_gb": {
          "title": "CPU per GB, user-space TLS",
          "description": "Milliseconds of proxy CPU per decimal gigabyte with tls.ktls = false (tunnel test only).",
          "type": "number"
        },
        "ktls_cpu_ms_per_gb": {
          "title": "CPU per GB, kernel TLS",
          "description": "Milliseconds of proxy CPU per decimal gigabyte with tls.ktls = true (tunnel test only).",
          "type": "number"
        }
      }
    }
  }
}
