{
  "$schema": "../schema/benchmarks.schema.json",
  "schema_version": 1,
  "campaign": "2026-10-28",
  "tests": [
    {
      "id": "plain-1kb",
      "transport": "plain",
      "label": "HTTP, 1 KB responses",
      "unit": "req/s",
      "direction": "higher",
      "conditions": "1 KB responses, keep-alive. Plain HTTP proxy port.",
      "chart": "plain-1kb.svg",
      "values": {
        "rustle": 55257.595,
        "3proxy": 21032.03,
        "squid": 15139.599,
        "gost": 4754.706,
        "tinyproxy": 7580.23
      },
      "at_conns": {
        "rustle": 64,
        "3proxy": 256,
        "squid": 64,
        "gost": 64,
        "tinyproxy": 64
      },
      "status": {
        "rustle": "ok",
        "3proxy": "ok",
        "squid": "ok",
        "gost": "ok",
        "tinyproxy": "ok"
      },
      "flags": {
        "rustle": [],
        "3proxy": [],
        "squid": [],
        "gost": [],
        "tinyproxy": []
      }
    },
    {
      "id": "plain-10kb",
      "transport": "plain",
      "label": "HTTP, 10 KB responses",
      "unit": "req/s",
      "direction": "higher",
      "conditions": "10 KB responses, keep-alive. Plain HTTP proxy port.",
      "chart": null,
      "values": {
        "rustle": 40782.877,
        "3proxy": 19169.111,
        "squid": 10814.248,
        "gost": 4436.468,
        "tinyproxy": 5669.191
      },
      "at_conns": {
        "rustle": 64,
        "3proxy": 256,
        "squid": 64,
        "gost": 64,
        "tinyproxy": 64
      },
      "status": {
        "rustle": "ok",
        "3proxy": "ok",
        "squid": "ok",
        "gost": "ok",
        "tinyproxy": "ok"
      },
      "flags": {
        "rustle": [],
        "3proxy": [],
        "squid": [],
        "gost": [],
        "tinyproxy": []
      }
    },
    {
      "id": "plain-short",
      "transport": "plain",
      "label": "HTTP, 1 KB responses, a new connection per request",
      "unit": "req/s",
      "direction": "higher",
      "conditions": "1 KB responses, no keep-alive. Plain HTTP proxy port.",
      "chart": null,
      "values": {
        "rustle": 27826.851,
        "3proxy": 5131.65,
        "squid": 7803.782,
        "gost": 4779.963,
        "tinyproxy": 7584.217
      },
      "at_conns": {
        "rustle": 256,
        "3proxy": 256,
        "squid": 64,
        "gost": 64,
        "tinyproxy": 64
      },
      "status": {
        "rustle": "ok",
        "3proxy": "ok",
        "squid": "ok",
        "gost": "ok",
        "tinyproxy": "ok"
      },
      "flags": {
        "rustle": [],
        "3proxy": [],
        "squid": [],
        "gost": [],
        "tinyproxy": []
      }
    },
    {
      "id": "plain-1mb",
      "transport": "plain",
      "label": "HTTP, 1 MB responses",
      "unit": "req/s",
      "direction": "higher",
      "conditions": "1 MB responses, keep-alive. Plain HTTP proxy port.",
      "chart": "plain-1mb.svg",
      "values": {
        "rustle": 2624.351,
        "3proxy": 1783.881,
        "squid": 352.843,
        "gost": 1045.84,
        "tinyproxy": 198.802
      },
      "at_conns": {
        "rustle": 16,
        "3proxy": 64,
        "squid": 16,
        "gost": 64,
        "tinyproxy": 256
      },
      "status": {
        "rustle": "ok",
        "3proxy": "ok",
        "squid": "ok",
        "gost": "ok",
        "tinyproxy": "ok"
      },
      "flags": {
        "rustle": [],
        "3proxy": [],
        "squid": [],
        "gost": [],
        "tinyproxy": []
      }
    },
    {
      "id": "plain-10mb",
      "transport": "plain",
      "label": "HTTP, 10 MB responses",
      "unit": "req/s",
      "direction": "higher",
      "conditions": "10 MB responses, keep-alive. Plain HTTP proxy port.",
      "chart": null,
      "values": {
        "rustle": 268.202,
        "3proxy": 191.143,
        "squid": 32.998,
        "gost": 144.937,
        "tinyproxy": 20.655
      },
      "at_conns": {
        "rustle": 32,
        "3proxy": 8,
        "squid": 8,
        "gost": 32,
        "tinyproxy": 32
      },
      "status": {
        "rustle": "ok",
        "3proxy": "ok",
        "squid": "ok",
        "gost": "ok",
        "tinyproxy": "ok"
      },
      "flags": {
        "rustle": [
          "proxy_unsaturated"
        ],
        "3proxy": [],
        "squid": [],
        "gost": [],
        "tinyproxy": []
      }
    },
    {
      "id": "plain-flood",
      "transport": "plain",
      "label": "CONNECT tunnels, bulk transfer",
      "unit": "Gbit/s",
      "direction": "higher",
      "conditions": "Bulk upload through CONNECT tunnels. Plain HTTP proxy port.",
      "chart": "plain-flood.svg",
      "values": {
        "rustle": 22.029,
        "3proxy": 15.68,
        "squid": 13.569,
        "gost": 13.225,
        "tinyproxy": 1.767
      },
      "at_conns": {
        "rustle": 8,
        "3proxy": 8,
        "squid": 8,
        "gost": 32,
        "tinyproxy": 32
      },
      "status": {
        "rustle": "ok",
        "3proxy": "ok",
        "squid": "ok",
        "gost": "ok",
        "tinyproxy": "ok"
      },
      "flags": {
        "rustle": [
          "proxy_unsaturated"
        ],
        "3proxy": [],
        "squid": [],
        "gost": [],
        "tinyproxy": []
      }
    },
    {
      "id": "plain-cpu",
      "transport": "plain",
      "label": "CPU cost per request (1 KB)",
      "unit": "µs/req",
      "direction": "lower",
      "conditions": "Proxy CPU per request, 1 KB responses, keep-alive. Plain HTTP proxy port.",
      "chart": "plain-cpu.svg",
      "values": {
        "rustle": 18.096,
        "3proxy": 47.569,
        "squid": 66.048,
        "gost": 210.01,
        "tinyproxy": 129.391
      },
      "at_conns": {
        "rustle": 64,
        "3proxy": 256,
        "squid": 64,
        "gost": 64,
        "tinyproxy": 64
      },
      "status": {
        "rustle": "ok",
        "3proxy": "ok",
        "squid": "ok",
        "gost": "ok",
        "tinyproxy": "ok"
      },
      "flags": {
        "rustle": [],
        "3proxy": [],
        "squid": [],
        "gost": [],
        "tinyproxy": []
      }
    },
    {
      "id": "plain-ram-1000",
      "transport": "plain",
      "label": "Memory with 1,000 open tunnels",
      "unit": "MB",
      "direction": "lower",
      "conditions": "1,000 idle CONNECT tunnels held open, peak RSS of the proxy. Plain HTTP proxy port.",
      "chart": null,
      "values": {
        "rustle": 14.0,
        "3proxy": 104.1,
        "squid": 150.0,
        "gost": 161.4,
        "tinyproxy": 18.4
      },
      "at_conns": {
        "rustle": null,
        "3proxy": null,
        "squid": null,
        "gost": null,
        "tinyproxy": null
      },
      "status": {
        "rustle": "ok",
        "3proxy": "ok",
        "squid": "ok",
        "gost": "ok",
        "tinyproxy": "ok"
      },
      "flags": {
        "rustle": [],
        "3proxy": [],
        "squid": [],
        "gost": [],
        "tinyproxy": []
      }
    },
    {
      "id": "plain-ram-5000",
      "transport": "plain",
      "label": "Memory with 5,000 open tunnels",
      "unit": "MB",
      "direction": "lower",
      "conditions": "5,000 idle CONNECT tunnels held open, peak RSS of the proxy. Plain HTTP proxy port.",
      "chart": null,
      "values": {
        "rustle": 40.4,
        "3proxy": 498.7,
        "squid": 275.3,
        "gost": 653.4,
        "tinyproxy": 61.4
      },
      "at_conns": {
        "rustle": null,
        "3proxy": null,
        "squid": null,
        "gost": null,
        "tinyproxy": null
      },
      "status": {
        "rustle": "ok",
        "3proxy": "ok",
        "squid": "ok",
        "gost": "ok",
        "tinyproxy": "ok"
      },
      "flags": {
        "rustle": [],
        "3proxy": [],
        "squid": [],
        "gost": [],
        "tinyproxy": []
      }
    },
    {
      "id": "plain-ram-10000",
      "transport": "plain",
      "label": "Memory with 10,000 open tunnels",
      "unit": "MB",
      "direction": "lower",
      "conditions": "10,000 idle CONNECT tunnels held open, peak RSS of the proxy. Plain HTTP proxy port.",
      "chart": null,
      "values": {
        "rustle": 54.2,
        "3proxy": 992.1,
        "squid": 432.1,
        "gost": 1242.7,
        "tinyproxy": 114.8
      },
      "at_conns": {
        "rustle": null,
        "3proxy": null,
        "squid": null,
        "gost": null,
        "tinyproxy": null
      },
      "status": {
        "rustle": "ok",
        "3proxy": "ok",
        "squid": "ok",
        "gost": "ok",
        "tinyproxy": "ok"
      },
      "flags": {
        "rustle": [],
        "3proxy": [],
        "squid": [],
        "gost": [],
        "tinyproxy": []
      }
    },
    {
      "id": "plain-ram-25000",
      "transport": "plain",
      "label": "Memory with 25,000 open tunnels",
      "unit": "MB",
      "direction": "lower",
      "conditions": "25,000 idle CONNECT tunnels held open, peak RSS of the proxy. Plain HTTP proxy port.",
      "chart": "plain-ram.svg",
      "values": {
        "rustle": 94.8,
        "3proxy": 2461.1,
        "squid": 912.3,
        "gost": 3228.4,
        "tinyproxy": 273.6
      },
      "at_conns": {
        "rustle": null,
        "3proxy": null,
        "squid": null,
        "gost": null,
        "tinyproxy": null
      },
      "status": {
        "rustle": "ok",
        "3proxy": "ok",
        "squid": "ok",
        "gost": "ok",
        "tinyproxy": "ok"
      },
      "flags": {
        "rustle": [],
        "3proxy": [],
        "squid": [],
        "gost": [],
        "tinyproxy": []
      }
    },
    {
      "id": "tls-1kb",
      "transport": "tls",
      "label": "HTTP, 1 KB responses",
      "unit": "req/s",
      "direction": "higher",
      "conditions": "1 KB responses, keep-alive. HTTPS proxy (TLS 1.3, AES-128-GCM, session resumption on).",
      "chart": "tls-1kb.svg",
      "values": {